<?xml version="1.0" encoding="UTF-8"?>
<!DOCTYPE biblioteca [
<!ELEMENT biblioteca (editorial+)>
<!ELEMENT editorial (nombre,email)>
<!ELEMENT nombre (#PCDATA) >
<!ELEMENT email (#PCDATA) > 
<!ATTLIST email tipo (corporativo|personal) >
<!ATTLIST biblioteca noNamespaceSchemaLocation CDATA #REQUIRED>
]
 >
<biblioteca noNamespaceSchemaLocation="libros.xsd">
    <editorial>
        <nombre>Editorial IA</nombre>
        <email tipo ="corporativo">john@gnmail.com</email>
    </editorial>
     <editorial>
        <nombre>Editorial advance</nombre>
        <email tipo ="personal"> jane@gmail.com</email>
    </editorial>
    <editorial>
        <nombre>Editorial IA</nombre>
        <email >byby@gmail.com</email> 
    </editorial>
</biblioteca>